{
  "schema_version": "1.0",
  "project": "swim-coach",
  "plan_version": "1.0",
  "updated_at": "2026-08-12T09:31:44-03:00",
  "active_phase": "P03",
  "phases": [
    {
      "id": "P00",
      "status": "DONE",
      "evidence": [
        "docs/evidence/p00-foundation-evidence.md",
        "docs/handoffs/p00.md",
        "local:make-check",
        "local:dependency-scan-clean",
        "local:secret-scan-clean",
        "local:docker-compose-healthy",
        "local:mcp-inspector-get-capabilities",
        "local:codex-exec-swim-coach-p00-get-capabilities",
        "personal-plugin:swim-coach@personal:0.0.0-spike",
        "garmin:real-read:no-external-write",
        "auth0:real-discovery:authorization-code-pkce-s256-dcr",
        "local:oauth-protected-resource:path-aware-resource-binding",
        "auth0:real-discovery:protected-resource-binding",
        "local:tunnel-client-doctor:oauth-metadata-pass",
        "openai:secure-mcp-tunnel:chatgpt-get-capabilities",
        "github:authenticated-keyring:ssh-remote-accessible",
        "https://github.com/felipefrmelo/swim-coach/pull/1",
        "https://github.com/felipefrmelo/swim-coach/actions/runs/31515474864"
      ],
      "commit": "2faaf62962501f464e2efb419127d6b4fd088512"
    },
    {
      "id": "P01",
      "status": "DONE",
      "evidence": [
        "docs/evidence/p01-domain-persistence-identity.md",
        "docs/evidence/p01-pwa-dashboard.png",
        "docs/handoffs/p01.md",
        "local:make-check:39-python:2-web",
        "local:testcontainers:migrations-up-down-up",
        "local:postgresql:000001-head:16-tables:55-constraints",
        "local:seed-initial-context:idempotent",
        "local:playwright:chrome-mobile-auth-context",
        "local:dependency-scan-clean",
        "local:secret-scan-clean",
        "local:docker-compose-healthy",
        "https://github.com/felipefrmelo/swim-coach/pull/2",
        "https://github.com/felipefrmelo/swim-coach/actions/runs/31546007309"
      ],
      "commit": "2e1e72274fe08137911959208e7b6c4ed22523ea"
    },
    {
      "id": "P02",
      "status": "IN_PROGRESS",
      "evidence": [
        "docs/evidence/p02-garmin-read-sync.md",
        "local:make-check:49-python:2-web",
        "local:testcontainers:migration-000002-up-down-up",
        "local:garmin-fixture:pagination-replay-deduplicated",
        "local:worker:rate-limit-retry-auth-terminal",
        "local:pwa:typescript-eslint-vitest-build",
        "local:playwright:chrome-mobile-garmin-no-browser-password",
        "garmin:real-read:p00-proof-not-yet-persisted-p02",
        "https://github.com/felipefrmelo/swim-coach/pull/3",
        "https://github.com/felipefrmelo/swim-coach/actions/runs/31549934953"
      ],
      "commit": "3319aa7f92594b0d3b45ad795c713af7a9f07e55"
    },
    {
      "id": "P03",
      "status": "IN_PROGRESS",
      "evidence": [
        "docs/evidence/p03-fit-normalization-analytics.md",
        "docs/handoffs/p03.md",
        "local:official-garmin-sdk:binary-fit-crc-roundtrip",
        "local:sanitized-golden:pool-swim-20m",
        "local:testcontainers:migration-000005-up-down-up",
        "local:normalization-analysis-feedback:replay-idempotent",
        "local:rest:no-raw-fit-storage-key-input-checksum",
        "local:pwa:mobile-quality-feedback",
        "local:make-check:87-python:2-web",
        "local:playwright:chrome-mobile:6-flows",
        "local:compose:healthy:artifact-volume-uid-10001-mode-0700",
        "local:dependency-scan-clean",
        "local:secret-scan-clean",
        "pending:p02-persistent-real-activity-manual-comparison"
      ],
      "commit": null
    },
    {
      "id": "P04",
      "status": "DONE",
      "evidence": [
        "docs/evidence/p04-workout-authoring-pwa.md",
        "docs/evidence/p04-workout-editor-mobile.png",
        "docs/handoffs/p04.md",
        "local:make-check:60-python:2-web",
        "local:testcontainers:migration-000003-up-down-up:immutable-trigger",
        "local:playwright:chrome-mobile:4-flows",
        "local:canonical-fixtures:technique-endurance-speed-test",
        "local:dependency-scan-clean",
        "local:secret-scan-clean",
        "local:no-garmin-provider-in-p04",
        "https://github.com/felipefrmelo/swim-coach/pull/4",
        "https://github.com/felipefrmelo/swim-coach/actions/runs/31551697015"
      ],
      "commit": "82e9e77184df4c0a57a6e5125737a022d46b9b59"
    },
    {
      "id": "P05",
      "status": "NOT_STARTED",
      "evidence": [],
      "commit": null
    },
    {
      "id": "P06",
      "status": "NOT_STARTED",
      "evidence": [],
      "commit": null
    },
    {
      "id": "P07",
      "status": "IN_PROGRESS",
      "evidence": [
        "local:p07-started-on-p04-linear-migration-chain",
        "docs/evidence/p07-garmin-write-pwa.md",
        "docs/evidence/p07-garmin-publish-mobile.png",
        "docs/handoffs/p07.md",
        "local:50-unit-tests:14-postgresql-integration-tests:2-web-tests",
        "local:make-check:75-python:2-web",
        "local:playwright:chrome-mobile:proposal-approve-publish-schedule-success",
        "local:ambiguous-create-schedule:reconciled-no-duplicate",
        "local:kill-switch:live-canary-only",
        "local:dependency-scan-clean",
        "local:secret-scan-clean",
        "github:draft-pr-5:ci-run-31553966600",
        "pending:garmin-real-disposable-canary"
      ],
      "commit": "c88d660"
    },
    {
      "id": "P08",
      "status": "NOT_STARTED",
      "evidence": [],
      "commit": null
    },
    {
      "id": "P09",
      "status": "NOT_STARTED",
      "evidence": [],
      "commit": null
    },
    {
      "id": "P10",
      "status": "NOT_STARTED",
      "evidence": [],
      "commit": null
    },
    {
      "id": "P11",
      "status": "NOT_STARTED",
      "evidence": [],
      "commit": null
    },
    {
      "id": "P12",
      "status": "NOT_STARTED",
      "evidence": [],
      "commit": null
    }
  ]
}
